{
    "manufacturer": "Keysight",
    "model": "DSOX1202G",
    "vendor_id": "0x2A8D",
    "product_id": "0x0397",
    "device_type": "oscilloscope",
    "trigger": {
        "types": [
            "HIGH",
            "LOW"
        ],
        "modes": [
            "EDGE",
            "GLITch",
            "PATTern",
            "SHOLd",
            "TRANsition",
            "TV",
            "SBUS1"
        ],
        "slopes": [
            "POS",
            "NEG",
            "EITH",
            "ALT"
        ]
    },
    "channels": {
        "1": {
            "description": "Analog Channel 1",
            "channel_range": {
                "min_val": -5,
                "max_val": 5
            },
            "input_coupling": [
                "DC",
                "AC"
            ],
            "input_impedance": 1e6,
            "probe_attenuation": [
                1,
                10
            ],
            "timebase": {
                "range": {
                    "min_val": 5e-9,
                    "max_val": 50
                },
                "horizontal_resolution": 1e-12
            }
        },
        "2": {
            "description": "Analog Channel 2",
            "channel_range": {
                "min_val": -5,
                "max_val": 5
            },
            "input_coupling": [
                "DC",
                "AC"
            ],
            "input_impedance": 1e6,
            "probe_attenuation": [
                1,
                10
            ],
            "timebase": {
                "range": {
                    "min_val": 5e-9,
                    "max_val": 50
                },
                "horizontal_resolution": 1e-12
            }
        }
    },
    "bandwidth": 70e6,
    "sampling_rate": 2e9,
    "memory": 2e6,
    "waveform_update_rate": 2e5,
    "fft": {
        "window_types": [
            "RECTangular",
            "HANNing",
            "FLATtop",
            "BHARris"
        ],
        "units": [
            "DECibel",
            "VRMS"
        ]
    },
    "function_generator": {
        "waveform_types": [
            "SINE",
            "SQUare",
            "RAMp",
            "PULse",
            "NOISe",
            "DC"
        ],
        "supported_states": [
            "ON",
            "OFF"
        ],
        "offset": {
            "min_val": -5,
            "max_val": 5
        },
        "frequency": {
            "min_val": 0.1,
            "max_val": 20e6
        },
        "amplitude": {
            "min_val": 2e-3,
            "max_val": 20
        }
    }
}